{
  "$schema": "http://json-schema.org/draft-07/schema#",
  "$id": "https://github.com/danielzanelli/NeuroCrunch/schemas/plugin_config.schema.json",
  "title": "NeuroCrunch Plugin Config",
  "description": "Schema for the config.json that must accompany every official or community script. See README.md > Plugin / Script Standard.",
  "type": "object",
  "required": ["name", "description", "category"],
  "additionalProperties": false,
  "properties": {
    "id": {
      "type": "string",
      "pattern": "^[A-Za-z0-9_-]+$",
      "description": "Unique script identifier. Auto-derived from the folder name when absent."
    },
    "name": { "$ref": "#/definitions/localizedString" },
    "description": { "$ref": "#/definitions/localizedString" },
    "version": { "type": "string", "default": "" },
    "author": { "type": "string", "default": "" },
    "category": { "type": "string" },
    "status": {
      "type": "string",
      "description": "Development status of the script. 'unfinished' scripts are shown in the UI as work-in-progress and cannot be run.",
      "enum": ["stable", "unfinished"],
      "default": "stable"
    },
    "entry_point": {
      "type": "string",
      "description": "Relative path to the Python entry point. Auto-derived as <folder_name>.py when absent."
    },
    "parameters": {
      "type": "array",
      "default": [],
      "items": { "$ref": "#/definitions/parameter" }
    },
    "outputs": {
      "type": "object",
      "default": {},
      "additionalProperties": { "$ref": "#/definitions/localizedString" }
    },
    "calibration": {
      "type": "object",
      "description": "Declares that this script supports interactive, in-app calibration. The app hosts a live preview (e.g. in the CSV viewer) that runs the script's pure preview() function so parameters can be tuned against real data. Optional.",
      "additionalProperties": false,
      "properties": {
        "kind": {
          "type": "string",
          "description": "The calibration surface this script plugs into. 'traces' = the CSV Filter-preview tab.",
          "enum": ["traces"]
        },
        "params": {
          "type": "array",
          "description": "Names of the parameters to expose as tunable knobs. Defaults to every non-file/directory parameter when omitted.",
          "items": { "type": "string" }
        }
      }
    }
  },
  "definitions": {
    "localizedString": {
      "description": "A bare string, or a map of locale code (e.g. 'es', 'en') to string.",
      "oneOf": [
        { "type": "string" },
        {
          "type": "object",
          "minProperties": 1,
          "additionalProperties": { "type": "string" }
        }
      ]
    },
    "parameter": {
      "type": "object",
      "required": ["name", "type"],
      "additionalProperties": false,
      "properties": {
        "name": { "type": "string" },
        "type": {
          "type": "string",
          "enum": ["string", "int", "float", "bool", "file", "directory", "choice", "text"]
        },
        "label": { "$ref": "#/definitions/localizedString" },
        "description": { "$ref": "#/definitions/localizedString" },
        "required": { "type": "boolean" },
        "default": {},
        "min": { "type": "number" },
        "max": { "type": "number" },
        "decimals": { "type": "integer" },
        "extensions": {
          "type": "array",
          "items": { "type": "string" }
        },
        "options": {
          "type": "array",
          "items": { "type": "string" }
        },
        "link": {
          "type": "string",
          "description": "Reference to a previous script's output as '{script_id}.{output_key}'."
        }
      }
    }
  }
}
