{
  "id": "connectivity_graph",
  "name": {"en": "Connectivity Graph", "es": "Grafo de Conectividad"},
  "description": {"en": "Builds a JSON Graph Format (JGF) connectivity network from a correlation matrix and an ROI list. Stores every pairwise weight; thresholding is done interactively in the viewer.", "es": "Construye una red de conectividad en formato JSON Graph Format (JGF) a partir de una matriz de correlación y una lista de ROIs. Guarda todos los pesos por pares; el umbral se aplica de forma interactiva en el visor."},
  "version": "2.2.0",
  "author": "Daniel Zanelli",
  "category": "visualization",
  "parameters": [
    {
      "name": "matrix_csv",
      "type": "file",
      "label": {"en": "Correlation matrix", "es": "Matriz de correlación"},
      "description": {"en": "CSV with a square correlation matrix (e.g. the Pearson matrix)", "es": "CSV con una matriz de correlación cuadrada (p. ej. la matriz de Pearson)"},
      "required": true,
      "extensions": [".csv"],
      "link": "pearson_matrix.matrix_csv"
    },
    {
      "name": "roi_zip",
      "type": "file",
      "label": {"en": "ROI list", "es": "Lista de ROIs"},
      "description": {"en": "ImageJ/FIJI ROI ZIP. ROI i corresponds to row/column i of the matrix", "es": "ZIP de ROIs de ImageJ/FIJI. El ROI i corresponde a la fila/columna i de la matriz"},
      "required": true,
      "extensions": [".zip"],
      "link": "generate_rois.roi_zip"
    },
    {
      "name": "output_dir",
      "type": "directory",
      "label": {"en": "Output folder", "es": "Carpeta de salida"},
      "required": true
    }
  ],
  "outputs": {
    "graph_jgf": {"en": "Path to the JSON Graph Format (.jgf) connectivity graph", "es": "Ruta del grafo de conectividad en JSON Graph Format (.jgf)"}
  }
}
