{
  "name": "Script template",
  "description": "A neutral example that shows every input type and every option you can declare. Copy this folder, rename it, and edit config.json + the .py file.",
  "category": "example",
  "version": "1.0.0",
  "author": "Your name here",

  "parameters": [

    {
      "name": "text_input",
      "type": "string",
      "label": "Text input (single line)",
      "description": "type \"string\" -> a single-line text box (QLineEdit). Optional keys: 'default', 'required'.",
      "default": "example text"
    },

    {
      "name": "long_text_input",
      "type": "text",
      "label": "Text input (multi-line)",
      "description": "type \"text\" -> a resizable multi-line box (QTextEdit), for longer notes. Optional keys: 'default', 'required'.",
      "default": ""
    },

    {
      "name": "whole_number",
      "type": "int",
      "label": "Whole number input",
      "description": "type \"int\" -> an integer stepper (QSpinBox). Optional keys: 'min', 'max', 'default', 'required'. Arrives in the script as a Python int.",
      "default": 10,
      "min": 0,
      "max": 1000
    },

    {
      "name": "whole_number_unbounded",
      "type": "int",
      "label": "Whole number input (no limits)",
      "description": "The same \"int\" type without 'min'/'max'. Omit those keys to allow any integer.",
      "default": 0
    },

    {
      "name": "decimal_number",
      "type": "float",
      "label": "Decimal number input",
      "description": "type \"float\" -> a decimal stepper (QDoubleSpinBox). Optional keys: 'min', 'max', 'decimals' (digits shown), 'default'. Arrives as a Python float.",
      "default": 0.25,
      "min": 0.0,
      "max": 1.0,
      "decimals": 2
    },

    {
      "name": "checkbox_option",
      "type": "bool",
      "label": "Checkbox input",
      "description": "type \"bool\" -> a checkbox (QCheckBox). Optional key: 'default' (true/false). Arrives as Python True or False.",
      "default": true
    },

    {
      "name": "dropdown_option",
      "type": "choice",
      "label": "Dropdown input",
      "description": "type \"choice\" -> a drop-down list (QComboBox). Requires 'options'. Optional key: 'default' (must be one of the options). Arrives as one of the option strings.",
      "options": ["first option", "second option", "third option"],
      "default": "first option"
    },

    {
      "name": "file_input",
      "type": "file",
      "label": "File input",
      "description": "type \"file\" -> a text box with a Browse button (file picker). Optional keys: 'extensions' (filters the dialog), 'required', 'default'. Arrives as an absolute path string. Marked required, so it shows a * and must be set before running.",
      "required": true,
      "extensions": [".csv", ".xlsx", ".txt"]
    },

    {
      "name": "file_input_any_type",
      "type": "file",
      "label": "File input (any type)",
      "description": "The same \"file\" type without 'extensions', so the picker shows all files. No 'required' key, so it is optional."
    },

    {
      "name": "folder_input",
      "type": "directory",
      "label": "Folder input",
      "description": "type \"directory\" -> a text box with a Browse button (folder picker). Optional keys: 'required', 'default'. Arrives as an absolute path string; create it with os.makedirs if needed.",
      "required": true
    },

    {
      "name": "localized_example",
      "type": "string",
      "label": { "en": "Localized label", "es": "Etiqueta traducida" },
      "description": {
        "en": "Any 'label' or 'description' can be a locale map {\"en\": ..., \"es\": ...} instead of a plain string, so your script's UI follows the app language.",
        "es": "Cualquier 'label' o 'description' puede ser un mapa de idiomas para que la interfaz siga el idioma de la aplicacion."
      },
      "default": ""
    },

    {
      "name": "linked_file_input",
      "type": "file",
      "label": "Linked file input",
      "description": "Add 'link': \"<script_id>.<output_key>\" to auto-fill this field from an earlier script's output. It is only a default: the user can re-point or clear the link with the link button. The reference must match a key in that script's 'outputs'.",
      "extensions": [".csv"],
      "link": "generate_signals.output_csv"
    }

  ],

  "outputs": {
    "output_file": "Absolute path to the main file this script produced.",
    "output_folder": "Absolute path to a folder holding any additional results (figures, tables, ...)."
  }
}
