{
  "id": "spike_analysis",
  "name": {"en": "Spike Analysis", "es": "Análisis de Spikes"},
  "description": {"en": "Measures every spike in each processed signal — start, end and width at half maximum, amplitude and area under the curve — and, if an ROI file is given, the position of its ROI.", "es": "Mide cada spike de las señales procesadas — inicio, fin y anchura a media altura, amplitud y área bajo la curva — y, si se da un archivo de ROIs, la posición de su ROI."},
  "version": "1.0.0",
  "author": "Daniel Zanelli",
  "category": "analysis",
  "parameters": [
    {
      "name": "input_csv",
      "type": "file",
      "label": {"en": "Input CSV", "es": "CSV de entrada"},
      "description": {"en": "CSV with the processed traces (spikes over a flat baseline)", "es": "CSV con las trazas procesadas (spikes sobre una línea base plana)"},
      "required": true,
      "extensions": [".csv"],
      "link": "band_pass_filter.filtered_csv"
    },
    {
      "name": "roi_zip",
      "type": "file",
      "label": {"en": "ROI list", "es": "Lista de ROIs"},
      "description": {"en": "Optional ImageJ/FIJI ROI ZIP. ROI i corresponds to signal i; its centroid gives the x/y columns. Leave empty to omit x/y", "es": "ZIP de ROIs de ImageJ/FIJI opcional. El ROI i corresponde a la señal i; su centroide da las columnas x/y. Dejar vacío para omitir x/y"},
      "extensions": [".zip"],
      "link": "generate_rois.roi_zip"
    },
    {
      "name": "column_order",
      "type": "choice",
      "label": {"en": "Column naming", "es": "Nombre de columnas"},
      "description": {"en": "Order of the parts in the signal column names: feature_neuron = <feature>_<neuron> (e.g. Mean_7), neuron_feature = <neuron>_<feature> (e.g. 7_Mean). The feature name may contain any character except '_'", "es": "Orden de las partes en los nombres de las columnas de señal: feature_neuron = <característica>_<neurona> (p. ej. Mean_7), neuron_feature = <neurona>_<característica> (p. ej. 7_Mean). El nombre de la característica puede contener cualquier carácter excepto '_'"},
      "options": ["feature_neuron", "neuron_feature"],
      "default": "feature_neuron"
    },
    {
      "name": "metrics",
      "type": "string",
      "label": {"en": "Metrics to process", "es": "Métricas a procesar"},
      "description": {"en": "Comma-separated list of features (e.g. Mean,Max), matched case-insensitively. Empty = all", "es": "Lista de características separadas por comas (p. ej. Mean,Max), sin distinguir mayúsculas. Vacío = todas"},
      "default": "Mean"
    },
    {
      "name": "threshold_std",
      "type": "float",
      "label": {"en": "Detection threshold (SD)", "es": "Umbral de detección (DE)"},
      "description": {"en": "A spike is detected where the signal rises this many robust standard deviations above its baseline", "es": "Se detecta un spike donde la señal supera su línea base en esta cantidad de desviaciones estándar robustas"},
      "default": 3.0,
      "min": 0.5,
      "max": 100.0,
      "decimals": 2
    },
    {
      "name": "height_fraction",
      "type": "float",
      "label": {"en": "Height fraction for the width", "es": "Fracción de altura para la anchura"},
      "description": {"en": "Fraction of each spike's own amplitude at which its start and end are measured. 0.5 = width at half maximum (FWHM)", "es": "Fracción de la amplitud de cada spike a la que se miden su inicio y su fin. 0.5 = anchura a media altura (FWHM)"},
      "default": 0.5,
      "min": 0.05,
      "max": 0.95,
      "decimals": 2
    },
    {
      "name": "min_duration",
      "type": "int",
      "label": {"en": "Minimum duration (frames)", "es": "Duración mínima (cuadros)"},
      "description": {"en": "Consecutive frames the signal must stay above the detection threshold to count as a spike", "es": "Cuadros consecutivos que la señal debe permanecer sobre el umbral de detección para contar como spike"},
      "default": 3,
      "min": 1,
      "max": 1000
    },
    {
      "name": "reference_start_s",
      "type": "float",
      "label": {"en": "SD reference start (s)", "es": "Inicio de referencia de DE (s)"},
      "description": {"en": "Start of the time window whose baseline and standard deviation define the detection threshold. 0 = start of the recording", "es": "Inicio de la ventana temporal cuya línea base y desviación estándar definen el umbral de detección. 0 = inicio del registro"},
      "default": 0.0,
      "min": 0.0,
      "decimals": 3
    },
    {
      "name": "reference_end_s",
      "type": "float",
      "label": {"en": "SD reference end (s)", "es": "Fin de referencia de DE (s)"},
      "description": {"en": "End of the reference time window. 0 = end of the recording (with start 0, the whole signal is the reference)", "es": "Fin de la ventana temporal de referencia. 0 = fin del registro (con inicio 0, toda la señal es la referencia)"},
      "default": 0.0,
      "min": 0.0,
      "decimals": 3
    },
    {
      "name": "fps",
      "type": "float",
      "label": {"en": "Sampling rate (fps)", "es": "Frecuencia de muestreo (fps)"},
      "description": {"en": "Frames per second, used to build the time axis only when the CSV has no time_s column", "es": "Cuadros por segundo, usado para construir el eje temporal solo cuando el CSV no tiene columna time_s"},
      "default": 10.0,
      "min": 0.001,
      "decimals": 3
    },
    {
      "name": "output_dir",
      "type": "directory",
      "label": {"en": "Output folder", "es": "Carpeta de salida"},
      "description": {"en": "Folder where the spikes file will be saved", "es": "Carpeta donde se guardará el archivo de spikes"},
      "required": true
    },
    {
      "name": "output_format",
      "type": "choice",
      "label": {"en": "Output format", "es": "Formato de salida"},
      "description": {"en": "xlsx = Excel spreadsheet, csv = comma-separated text", "es": "xlsx = hoja de cálculo de Excel, csv = texto separado por comas"},
      "options": ["xlsx", "csv"],
      "default": "xlsx"
    }
  ],
  "outputs": {
    "spikes_file": {"en": "Path to the spreadsheet (xlsx or csv) with one row per detected spike", "es": "Ruta de la hoja de cálculo (xlsx o csv) con una fila por spike detectado"}
  },
  "calibration": {
    "kind": "traces",
    "params": ["threshold_std", "height_fraction", "min_duration", "reference_start_s", "reference_end_s", "fps"]
  }
}
