{
  "id": "pearson_matrix",
  "name": {"en": "Pearson Matrix", "es": "Matriz de Pearson"},
  "description": {"en": "Computes a Pearson correlation matrix between neurons for a chosen metric.", "es": "Calcula una matriz de correlación de Pearson entre neuronas para una métrica elegida."},
  "version": "2.0.0",
  "author": "Daniel Zanelli",
  "category": "analysis",
  "parameters": [
    {
      "name": "input_csv",
      "type": "file",
      "label": {"en": "Input CSV", "es": "CSV de entrada"},
      "description": {"en": "CSV file with the fluorescence traces", "es": "Archivo CSV con las trazas de fluorescencia"},
      "required": true,
      "extensions": [".csv"],
      "link": "select_active.active_csv"
    },
    {
      "name": "column_order",
      "type": "choice",
      "label": {"en": "Column naming", "es": "Nombre de columnas"},
      "description": {"en": "Order of the parts in the signal column names: feature_neuron = <feature>_<neuron> (e.g. Mean_7), neuron_feature = <neuron>_<feature> (e.g. 7_Mean). The feature name may contain any character except '_'", "es": "Orden de las partes en los nombres de las columnas de señal: feature_neuron = <característica>_<neurona> (p. ej. Mean_7), neuron_feature = <neurona>_<característica> (p. ej. 7_Mean). El nombre de la característica puede contener cualquier carácter excepto '_'"},
      "options": ["feature_neuron", "neuron_feature"],
      "default": "feature_neuron"
    },
    {
      "name": "metric",
      "type": "string",
      "label": {"en": "Metric", "es": "Métrica"},
      "description": {"en": "Which per-neuron feature to correlate: a generate_signals metric (Mean, Max, Std, Int) or any external feature name present in the columns. Case-insensitive; an unambiguous prefix also matches ('Std' matches 'StdDev').", "es": "Qué característica por neurona correlacionar: una métrica de generate_signals (Mean, Max, Std, Int) o cualquier característica externa presente en las columnas. Sin distinguir mayúsculas; un prefijo no ambiguo también coincide ('Std' coincide con 'StdDev')."},
      "default": "Mean"
    },
    {
      "name": "output_dir",
      "type": "directory",
      "label": {"en": "Output folder", "es": "Carpeta de salida"},
      "required": true
    }
  ],
  "outputs": {
    "matrix_csv": {"en": "Path to the CSV with the correlation matrix", "es": "Ruta del CSV con la matriz de correlación"},
    "heatmap_png": {"en": "Path to the correlation heatmap image", "es": "Ruta de la imagen del mapa de calor de correlación"}
  }
}
