{
  "id": "mutual_information",
  "name": {"en": "Mutual Information", "es": "Información Mutua"},
  "description": {"en": "Computes a normalised mutual-information matrix between neurons for a chosen metric (captures non-linear dependence, unlike Pearson).", "es": "Calcula una matriz de información mutua normalizada entre neuronas para una métrica elegida (capta dependencias no lineales, a diferencia de Pearson)."},
  "version": "1.0.0",
  "author": "Daniel Zanelli",
  "category": "analysis",
  "parameters": [
    {
      "name": "input_csv",
      "type": "file",
      "label": {"en": "Input CSV", "es": "CSV de entrada"},
      "description": {"en": "CSV file with the fluorescence traces", "es": "Archivo CSV con las trazas de fluorescencia"},
      "required": true,
      "extensions": [".csv"],
      "link": "select_active.active_csv"
    },
    {
      "name": "column_order",
      "type": "choice",
      "label": {"en": "Column naming", "es": "Nombre de columnas"},
      "description": {"en": "Order of the parts in the signal column names: feature_neuron = <feature>_<neuron> (e.g. Mean_7), neuron_feature = <neuron>_<feature> (e.g. 7_Mean). The feature name may contain any character except '_'", "es": "Orden de las partes en los nombres de las columnas de señal: feature_neuron = <característica>_<neurona> (p. ej. Mean_7), neuron_feature = <neurona>_<característica> (p. ej. 7_Mean). El nombre de la característica puede contener cualquier carácter excepto '_'"},
      "options": ["feature_neuron", "neuron_feature"],
      "default": "feature_neuron"
    },
    {
      "name": "metric",
      "type": "string",
      "label": {"en": "Metric", "es": "Métrica"},
      "description": {"en": "Which per-neuron feature to analyse: a generate_signals metric (Mean, Max, Std, Int) or any external feature name present in the columns. Case-insensitive; an unambiguous prefix also matches ('Std' matches 'StdDev').", "es": "Qué característica por neurona analizar: una métrica de generate_signals (Mean, Max, Std, Int) o cualquier característica externa presente en las columnas. Sin distinguir mayúsculas; un prefijo no ambiguo también coincide ('Std' coincide con 'StdDev')."},
      "default": "Mean"
    },
    {
      "name": "bins",
      "type": "choice",
      "label": {"en": "Histogram bins", "es": "Bins del histograma"},
      "description": {"en": "Number of equal-width bins used to estimate each signal's distribution. 'auto' picks a value from the number of frames.", "es": "Número de bins de igual ancho para estimar la distribución de cada señal. 'auto' elige un valor según la cantidad de cuadros."},
      "options": ["auto", "8", "16", "32", "64"],
      "default": "auto"
    },
    {
      "name": "output_dir",
      "type": "directory",
      "label": {"en": "Output folder", "es": "Carpeta de salida"},
      "required": true
    }
  ],
  "outputs": {
    "matrix_csv": {"en": "Path to the CSV with the mutual-information matrix", "es": "Ruta del CSV con la matriz de información mutua"},
    "heatmap_png": {"en": "Path to the mutual-information heatmap image", "es": "Ruta de la imagen del mapa de calor de información mutua"}
  }
}
