{
  "id": "remove_bleaching",
  "name": "Remove Bleaching",
  "description": "Removes photobleaching effects from fluorescence signals.",
  "version": "1.0.0",
  "author": "Daniel Zanelli",
  "category": "processing",
  "parameters": [
    {
      "name": "input_csv",
      "type": "file",
      "label": "Input CSV",
      "description": "CSV file with the raw fluorescence traces",
      "required": true,
      "extensions": [".csv"],
      "link": "process_video.output_csv"
    },
    {
      "name": "metrics",
      "type": "string",
      "label": "Metrics to process",
      "description": "Comma-separated list (e.g. Mean,Max). Empty = all",
      "default": "Mean"
    },
    {
      "name": "baseline_lam",
      "type": "float",
      "label": "ALS baseline: lambda",
      "description": "Regularization of the first ALS correction",
      "default": 100000.0,
      "min": 0.0,
      "decimals": 6
    },
    {
      "name": "baseline_p",
      "type": "float",
      "label": "ALS baseline: p",
      "description": "Weight asymmetry of the first ALS correction",
      "default": 0.01,
      "min": 0.0,
      "max": 1.0,
      "decimals": 6
    },
    {
      "name": "baseline_niter",
      "type": "int",
      "label": "ALS baseline: iterations",
      "description": "Iterations for the first ALS correction",
      "default": 10,
      "min": 1,
      "max": 200
    },
    {
      "name": "baseline_lam_factor",
      "type": "float",
      "label": "ALS baseline: lambda factor",
      "description": "Lambda factor for the adaptive ramp at the start and end",
      "default": 0.001,
      "min": 0.0,
      "decimals": 6
    },
    {
      "name": "baseline_rampup_fraction",
      "type": "float",
      "label": "ALS baseline: ramp-up fraction",
      "description": "Initial fraction of samples with a lambda ramp",
      "default": 0.2,
      "min": 0.0,
      "max": 1.0,
      "decimals": 4
    },
    {
      "name": "baseline_rampdown_fraction",
      "type": "float",
      "label": "ALS baseline: ramp-down fraction",
      "description": "Final fraction of samples with a lambda ramp",
      "default": 0.2,
      "min": 0.0,
      "max": 1.0,
      "decimals": 4
    },
    {
      "name": "smooth_lam",
      "type": "float",
      "label": "ALS final smoothing: lambda",
      "description": "Regularization for the final smoothing over the corrected signal",
      "default": 10.0,
      "min": 0.0,
      "decimals": 6
    },
    {
      "name": "smooth_p",
      "type": "float",
      "label": "ALS final smoothing: p",
      "description": "Weight asymmetry of the final smoothing",
      "default": 0.5,
      "min": 0.0,
      "max": 1.0,
      "decimals": 6
    },
    {
      "name": "smooth_niter",
      "type": "int",
      "label": "ALS final smoothing: iterations",
      "description": "Iterations for the final smoothing",
      "default": 10,
      "min": 1,
      "max": 200
    },
    {
      "name": "output_dir",
      "type": "directory",
      "label": "Output folder",
      "description": "Folder where the corrected CSV will be saved",
      "required": true
    }
  ],
  "outputs": {
    "baseline_csv": "Path to the CSV with the estimated ALS baseline",
    "corrected_csv": "Path to the CSV file with the corrected traces"
    ,"smoothed_csv": "Path to the CSV with the final smoothed signal"
  }
}
