{
  "id": "select_active",
  "name": {"en": "Select Active", "es": "Seleccionar Activas"},
  "description": {"en": "Selects active cells/traces based on activity criteria.", "es": "Selecciona las células/trazas activas según criterios de actividad."},
  "version": "1.0.0",
  "author": "Daniel Zanelli",
  "category": "processing",
  "parameters": [
    {
      "name": "input_csv",
      "type": "file",
      "label": {"en": "Input CSV", "es": "CSV de entrada"},
      "description": {"en": "CSV file with the fluorescence traces", "es": "Archivo CSV con las trazas de fluorescencia"},
      "required": true,
      "extensions": [".csv"],
      "link": "als_filter.smoothed_csv"
    },
    {
      "name": "threshold_std",
      "type": "float",
      "label": {"en": "Threshold (standard deviations)", "es": "Umbral (desviaciones estándar)"},
      "description": {"en": "Robust deviations (median + k·MAD) above the median that a stretch of frames must exceed to count a cell as active", "es": "Desviaciones robustas (mediana + k·MAD) por encima de la mediana que un tramo de cuadros debe superar para considerar activa una célula"},
      "default": 2.5,
      "min": 0.5,
      "max": 100.0,
      "decimals": 2
    },
    {
      "name": "min_duration",
      "type": "int",
      "label": {"en": "Minimum duration (frames)", "es": "Duración mínima (cuadros)"},
      "description": {"en": "Minimum number of consecutive frames above the threshold to count as an event", "es": "Número mínimo de cuadros consecutivos por encima del umbral para contar como un evento"},
      "default": 3,
      "min": 1,
      "max": 1000
    },
    {
      "name": "reference_start_s",
      "type": "float",
      "label": {"en": "SD reference start (s)", "es": "Inicio de referencia de DE (s)"},
      "description": {"en": "Start of the time window whose median and robust deviation define the activity threshold. 0 = start of the recording", "es": "Inicio de la ventana temporal cuya mediana y desviación robusta definen el umbral de actividad. 0 = inicio del registro"},
      "default": 0.0,
      "min": 0.0,
      "decimals": 3
    },
    {
      "name": "reference_end_s",
      "type": "float",
      "label": {"en": "SD reference end (s)", "es": "Fin de referencia de DE (s)"},
      "description": {"en": "End of the reference time window. 0 = end of the recording (with start 0, the whole signal is the reference)", "es": "Fin de la ventana temporal de referencia. 0 = fin del registro (con inicio 0, toda la señal es la referencia)"},
      "default": 0.0,
      "min": 0.0,
      "decimals": 3
    },
    {
      "name": "fps",
      "type": "float",
      "label": {"en": "Sampling rate (fps)", "es": "Frecuencia de muestreo (fps)"},
      "description": {"en": "Frames per second, used to place the reference window only when the CSV has no time_s column", "es": "Cuadros por segundo, usado para ubicar la ventana de referencia solo cuando el CSV no tiene columna time_s"},
      "default": 10.0,
      "min": 0.001,
      "decimals": 3
    },
    {
      "name": "output_dir",
      "type": "directory",
      "label": {"en": "Output folder", "es": "Carpeta de salida"},
      "required": true
    }
  ],
  "outputs": {
    "active_csv": {"en": "Path to the CSV with the traces of active cells only", "es": "Ruta del CSV con las trazas de las células activas únicamente"}
  },
  "calibration": {
    "kind": "traces",
    "params": ["threshold_std", "min_duration", "reference_start_s", "reference_end_s", "fps"]
  }
}
