{
  "id": "generate_signals",
  "name": {"en": "Generate Signals", "es": "Generar Señales"},
  "description": {"en": "Extracts fluorescence traces from a calcium-imaging video.", "es": "Extrae las trazas de fluorescencia de un vídeo de imagen de calcio."},
  "version": "1.1.0",
  "author": "Daniel Zanelli",
  "category": "preprocessing",
  "parameters": [
    {
      "name": "input_video",
      "type": "file",
      "label": {"en": "Input video", "es": "Video de entrada"},
      "description": {"en": "Calcium-imaging video file (.tif, .tiff, .avi, .mp4)", "es": "Archivo de video de imágenes de calcio (.tif, .tiff, .avi, .mp4)"},
      "required": true,
      "extensions": [".tif", ".tiff", ".avi", ".mp4"]
    },
    {
      "name": "input_roi",
      "type": "file",
      "label": {"en": "ROI file", "es": "Archivo de ROI"},
      "description": {"en": "ZIP file with the regions of interest (.zip, generated by ImageJ/FIJI or the Generate ROIs script)", "es": "Archivo ZIP con las regiones de interés (.zip, generado por ImageJ/FIJI o el script Generate ROIs)"},
      "required": true,
      "extensions": [".zip"],
      "link": "generate_rois.roi_zip"
    },
    {
      "name": "fps",
      "type": "int",
      "label": {"en": "Frames per second", "es": "Cuadros por segundo"},
      "description": {"en": "Video sampling rate", "es": "Frecuencia de muestreo del video"},
      "default": 10,
      "min": 1,
      "max": 1000
    },
    {
      "name": "column_order",
      "type": "choice",
      "label": {"en": "Column naming", "es": "Nombre de columnas"},
      "description": {"en": "Order of the parts in the output column names: feature_neuron = <feature>_<neuron> (e.g. Mean_7), neuron_feature = <neuron>_<feature> (e.g. 7_Mean)", "es": "Orden de las partes en los nombres de las columnas de salida: feature_neuron = <característica>_<neurona> (p. ej. Mean_7), neuron_feature = <neurona>_<característica> (p. ej. 7_Mean)"},
      "options": ["feature_neuron", "neuron_feature"],
      "default": "feature_neuron"
    },
    {
      "name": "metric_max",
      "type": "bool",
      "label": {"en": "Metric: Maximum", "es": "Métrica: Máximo"},
      "description": {"en": "Computes the maximum pixel value within each ROI per frame", "es": "Calcula el valor máximo de píxel dentro de cada ROI por cuadro"},
      "default": true
    },
    {
      "name": "metric_mean",
      "type": "bool",
      "label": {"en": "Metric: Mean", "es": "Métrica: Media"},
      "description": {"en": "Computes the mean pixel value within each ROI per frame", "es": "Calcula el valor medio de píxel dentro de cada ROI por cuadro"},
      "default": true
    },
    {
      "name": "metric_std",
      "type": "bool",
      "label": {"en": "Metric: Standard deviation", "es": "Métrica: Desviación estándar"},
      "description": {"en": "Computes the standard deviation of pixels within each ROI per frame", "es": "Calcula la desviación estándar de los píxeles dentro de cada ROI por cuadro"},
      "default": true
    },
    {
      "name": "metric_int",
      "type": "bool",
      "label": {"en": "Metric: Integral", "es": "Métrica: Integral"},
      "description": {"en": "Computes the sum (integral) of pixels within each ROI per frame", "es": "Calcula la suma (integral) de los píxeles dentro de cada ROI por cuadro"},
      "default": true
    },
    {
      "name": "output_dir",
      "type": "directory",
      "label": {"en": "Output folder", "es": "Carpeta de salida"},
      "description": {"en": "Folder where the results will be saved", "es": "Carpeta donde se guardarán los resultados"},
      "required": true
    },
    {
      "name": "normalize",
      "type": "bool",
      "label": {"en": "Normalize signals", "es": "Normalizar señales"},
      "description": {"en": "Applies Z-score normalization to the extracted traces", "es": "Aplica normalización Z-score a las trazas extraídas"},
      "default": false
    }
  ],
  "outputs": {
    "output_csv": {"en": "Path to the CSV file with the extracted fluorescence traces", "es": "Ruta del archivo CSV con las trazas de fluorescencia extraídas"}
  }
}
