{
  "id": "als_filter",
  "name": {"en": "ALS Filter", "es": "Filtro ALS"},
  "description": {"en": "Removes photobleaching effects from fluorescence signals.", "es": "Elimina los efectos del fotoblanqueo de las señales de fluorescencia."},
  "version": "1.0.0",
  "author": "Daniel Zanelli",
  "category": "processing",
  "parameters": [
    {
      "name": "input_csv",
      "type": "file",
      "label": {"en": "Input CSV", "es": "CSV de entrada"},
      "description": {"en": "CSV file with the raw fluorescence traces", "es": "Archivo CSV con las trazas de fluorescencia sin procesar"},
      "required": true,
      "extensions": [".csv"],
      "link": "generate_signals.output_csv"
    },
    {
      "name": "column_order",
      "type": "choice",
      "label": {"en": "Column naming", "es": "Nombre de columnas"},
      "description": {"en": "Order of the parts in the signal column names: feature_neuron = <feature>_<neuron> (e.g. Mean_7), neuron_feature = <neuron>_<feature> (e.g. 7_Mean). The feature name may contain any character except '_'", "es": "Orden de las partes en los nombres de las columnas de señal: feature_neuron = <característica>_<neurona> (p. ej. Mean_7), neuron_feature = <neurona>_<característica> (p. ej. 7_Mean). El nombre de la característica puede contener cualquier carácter excepto '_'"},
      "options": ["feature_neuron", "neuron_feature"],
      "default": "feature_neuron"
    },
    {
      "name": "metrics",
      "type": "string",
      "label": {"en": "Metrics to process", "es": "Métricas a procesar"},
      "description": {"en": "Comma-separated list of features (e.g. Mean,Max), matched case-insensitively. Empty = all", "es": "Lista de características separadas por comas (p. ej. Mean,Max), sin distinguir mayúsculas. Vacío = todas"},
      "default": "Mean"
    },
    {
      "name": "baseline_offset",
      "type": "float",
      "label": {"en": "Signal offset", "es": "Desplazamiento de señal"},
      "description": {"en": "Constant added to the signal before the baseline, to keep the correction's denominator away from zero. 0 = disabled", "es": "Constante sumada a la señal antes de la línea base, para mantener el denominador de la corrección lejos de cero. 0 = desactivado"},
      "default": 0.0,
      "min": 0.0,
      "decimals": 6
    },
    {
      "name": "baseline_lam",
      "type": "float",
      "label": {"en": "ALS baseline: lambda", "es": "Línea base ALS: lambda"},
      "description": {"en": "Regularization of the first ALS correction", "es": "Regularización de la primera corrección ALS"},
      "default": 100000.0,
      "min": 0.0,
      "decimals": 6
    },
    {
      "name": "baseline_p",
      "type": "float",
      "label": {"en": "ALS baseline: p", "es": "Línea base ALS: p"},
      "description": {"en": "Weight asymmetry of the first ALS correction", "es": "Asimetría de peso de la primera corrección ALS"},
      "default": 0.01,
      "min": 0.0,
      "max": 1.0,
      "decimals": 6
    },
    {
      "name": "baseline_niter",
      "type": "int",
      "label": {"en": "ALS baseline: iterations", "es": "Línea base ALS: iteraciones"},
      "description": {"en": "Iterations for the first ALS correction", "es": "Iteraciones para la primera corrección ALS"},
      "default": 10,
      "min": 1,
      "max": 200
    },
    {
      "name": "baseline_lam_factor",
      "type": "float",
      "label": {"en": "ALS baseline: lambda factor", "es": "Línea base ALS: factor lambda"},
      "description": {"en": "Lambda factor for the adaptive ramp at the start and end", "es": "Factor lambda para la rampa adaptativa al inicio y al final"},
      "default": 0.001,
      "min": 0.0,
      "decimals": 6
    },
    {
      "name": "baseline_rampup_fraction",
      "type": "float",
      "label": {"en": "ALS baseline: ramp-up fraction", "es": "Línea base ALS: fracción de rampa ascendente"},
      "description": {"en": "Initial fraction of samples with a lambda ramp", "es": "Fracción inicial de muestras con rampa de lambda"},
      "default": 0.2,
      "min": 0.0,
      "max": 1.0,
      "decimals": 4
    },
    {
      "name": "baseline_rampdown_fraction",
      "type": "float",
      "label": {"en": "ALS baseline: ramp-down fraction", "es": "Línea base ALS: fracción de rampa descendente"},
      "description": {"en": "Final fraction of samples with a lambda ramp", "es": "Fracción final de muestras con rampa de lambda"},
      "default": 0.2,
      "min": 0.0,
      "max": 1.0,
      "decimals": 4
    },
    {
      "name": "smooth_lam",
      "type": "float",
      "label": {"en": "ALS final smoothing: lambda", "es": "Suavizado final ALS: lambda"},
      "description": {"en": "Regularization for the final smoothing over the corrected signal", "es": "Regularización para el suavizado final sobre la señal corregida"},
      "default": 10.0,
      "min": 0.0,
      "decimals": 6
    },
    {
      "name": "smooth_p",
      "type": "float",
      "label": {"en": "ALS final smoothing: p", "es": "Suavizado final ALS: p"},
      "description": {"en": "Weight asymmetry of the final smoothing", "es": "Asimetría de peso del suavizado final"},
      "default": 0.5,
      "min": 0.0,
      "max": 1.0,
      "decimals": 6
    },
    {
      "name": "smooth_niter",
      "type": "int",
      "label": {"en": "ALS final smoothing: iterations", "es": "Suavizado final ALS: iteraciones"},
      "description": {"en": "Iterations for the final smoothing", "es": "Iteraciones para el suavizado final"},
      "default": 10,
      "min": 1,
      "max": 200
    },
    {
      "name": "output_dir",
      "type": "directory",
      "label": {"en": "Output folder", "es": "Carpeta de salida"},
      "description": {"en": "Folder where the corrected CSV will be saved", "es": "Carpeta donde se guardará el CSV corregido"},
      "required": true
    }
  ],
  "outputs": {
    "smoothed_csv": {"en": "Path to the CSV with the final smoothed signal", "es": "Ruta del CSV con la señal final suavizada"}
  },
  "calibration": {
    "kind": "traces",
    "params": [
      "baseline_offset",
      "baseline_lam",
      "baseline_p",
      "baseline_niter",
      "baseline_lam_factor",
      "baseline_rampup_fraction",
      "baseline_rampdown_fraction",
      "smooth_lam",
      "smooth_p",
      "smooth_niter"
    ]
  }
}
